{
  "$schema": "https://json-schema.org/draft/2020-12/schema",
  "$id": "https://github.com/Pythia-Software/query-table/schema/query-table.schema.json",
  "title": "query-table field schema",
  "description": "A dataset's field schema: the single source of truth that codegen projects into the TS catalog (@pythia-software/query-table-core FieldDef[]) and the backend schema (backends/go FieldSpec). Backend-specific SQL lives under each field's `bindings`, so non-SQL/non-Go backends can bind the same document later.",
  "type": "object",
  "required": ["name", "idField", "fields"],
  "additionalProperties": false,
  "properties": {
    "$schema": { "type": "string" },
    "name": {
      "type": "string",
      "description": "Dataset id; also the StorageAdapter namespace for saved queries.",
      "pattern": "^[a-z][a-z0-9_]*$"
    },
    "version": { "type": "integer", "minimum": 1, "default": 1 },
    "idField": { "type": "string", "description": "Field whose value is a row's stable id (selection, per-row refresh)." },
    "defaultLimit": { "type": "integer", "minimum": 1, "default": 100 },
    "defaultSort": {
      "type": "array",
      "description": "ORDER BY applied when the query's orderBy is empty.",
      "items": { "$ref": "#/$defs/orderByClause" }
    },
    "tiebreakSort": {
      "type": "array",
      "description": "Always appended after the user's sort so paging is deterministic (e.g. [{field:id,dir:asc}]).",
      "items": { "$ref": "#/$defs/orderByClause" }
    },
    "defaultSelect": {
      "type": "array",
      "description": "Visible columns when the query's select is empty (in display order).",
      "items": { "$ref": "#/$defs/selectColumn" }
    },
    "fields": { "type": "array", "minItems": 1, "items": { "$ref": "#/$defs/field" } }
  },
  "$defs": {
    "propertyField": {
      "type": "object",
      "additionalProperties": false,
      "properties": {
        "enabled": {
          "type": "boolean"
        },
        "default": {
          "type": "boolean"
        },
        "render": {
          "type": "string"
        },
        "format": {
          "$ref": "#/$defs/propertyFormat"
        }
      }
    },
    "propertyFormat": {
      "oneOf": [
        {
          "type": "object",
          "required": [
            "kind"
          ],
          "additionalProperties": false,
          "properties": {
            "kind": {
              "enum": [
                "text",
                "code",
                "boolean",
                "chips",
                "relative",
                "currency",
                "number",
                "percent",
                "duration",
                "date",
                "time",
                "datetime"
              ]
            },
            "decimals": {
              "type": "integer",
              "minimum": 0,
              "maximum": 20
            },
            "currency": {
              "type": "string",
              "pattern": "^[A-Z]{3}$"
            },
            "sourceUnit": {
              "enum": [
                "milliseconds",
                "seconds",
                "minutes",
                "hours",
                "days",
                "iso",
                "epochSeconds",
                "epochMilliseconds",
                "secondsOfDay",
                "millisecondsOfDay"
              ]
            },
            "style": {
              "enum": [
                "human",
                "long",
                "clock",
                "custom",
                "iso"
              ]
            },
            "pattern": {
              "type": "string",
              "maxLength": 1000
            },
            "timeZone": {
              "type": "string",
              "maxLength": 256
            }
          },
          "allOf": [
            {
              "if": {
                "properties": {
                  "kind": {
                    "const": "currency"
                  }
                }
              },
              "then": {
                "required": [
                  "currency"
                ]
              }
            }
          ]
        },
        {
          "$ref": "#/$defs/jsonCellDisplay"
        },
        {
          "$ref": "#/$defs/chipCellDisplay"
        }
      ]
    },
    "fieldType": { "enum": ["text", "number", "enum", "datetime", "bool", "textarray"] },
    "filterOp": {
      "enum": ["=", "!=", ">", ">=", "<", "<=", "contains", "starts_with", "ends_with", "matches_regex", "not_matches_regex", "length_gt", "length_lt", "length_eq", "includes", "is_null", "is_not_null"]
    },
    "aggOp": {
      "enum": ["count", "count_distinct", "sum", "avg", "min", "max"]
    },
    "orderByClause": {
      "type": "object",
      "required": ["field", "dir"],
      "additionalProperties": false,
      "properties": {
        "field": { "type": "string" },
        "dir": { "enum": ["asc", "desc"] },
        "nulls": { "enum": ["first", "last"] },
        "extract": {
          "type": "object",
          "required": ["regex"],
          "additionalProperties": false,
          "description": "Sort by the first capture group of a regex match, or the whole match when there is no capture group. A non-match is NULL.",
          "properties": { "regex": { "type": "string", "maxLength": 10000 } }
        }
      }
    },
    "selectColumn": {
      "type": "object",
      "required": ["field"],
      "additionalProperties": false,
      "properties": { "field": { "type": "string" }, "width": { "type": "number", "minimum": 1 } }
    },
    "field": {
      "type": "object",
      "required": ["name", "label", "type"],
      "additionalProperties": false,
      "description": "One field. `source` says WHAT KIND of field it is (the value origin + server capability); `filter`/`sort`/`select` are declarative capability config; `render` is a registry key the frontend resolves to a renderer; `bindings` is the backend SQL.",
      "properties": {
        "name": { "type": "string", "description": "Canonical id; matches Where/OrderBy field + the backend binding key." },
        "label": { "type": "string" },
        "type": { "$ref": "#/$defs/fieldType" },
        "source": {
          "description": "Value origin. String shorthand or object. Omitted ⇒ inferred: `backend` if `bindings` present, else `derived`. (A derived field's `accessor` is code and is attached at runtime, never in JSON.)",
          "oneOf": [
            { "enum": ["backend", "derived"] },
            {
              "type": "object",
              "required": ["kind"],
              "additionalProperties": false,
              "properties": {
                "kind": { "enum": ["backend", "derived"] },
                "path": { "type": "string", "description": "Dotted path into the API row when it differs from `name`." },
                "synthetic": { "type": "boolean", "description": "Computed SQL with no backing column." }
              }
            }
          ]
        },
        "filter": {
          "type": "object",
          "additionalProperties": false,
          "properties": {
            "enabled": { "type": "boolean", "description": "Default: backend ⇒ true, derived ⇒ false." },
            "editor": { "enum": ["set"], "description": "Native ANY/ALL/NONE/EMPTY editor for textarray fields." },
            "arrayCaseSensitive": { "type": "boolean", "description": "Preserve case when matching textarray values. Default false." },
            "pushdown": { "type": "boolean", "description": "Evaluate on the backend? Default backend ⇒ true. false ⇒ applied client-side by applyQuery." },
            "ops": { "type": "array", "items": { "$ref": "#/$defs/filterOp" } },
            "values": { "$ref": "#/$defs/filterValues" }
          }
        },
        "sort": {
          "type": "object",
          "additionalProperties": false,
          "properties": {
            "enabled": { "type": "boolean", "description": "Default: backend ⇒ true, derived ⇒ false." },
            "field": { "type": "string", "description": "Server field to ORDER BY when it differs from the display field." }
          }
        },
        "select": {
          "type": "object",
          "additionalProperties": false,
          "properties": {
            "enabled": { "type": "boolean", "description": "Can it be a visible column? Default true. false ⇒ filter-only." },
            "default": { "type": "boolean", "description": "Shown when the query's select is empty." },
            "width": { "type": "number", "minimum": 1 },
            "align": { "enum": ["left", "right", "center"] }
          }
        },
        "aggregate": {
          "type": "object",
          "description": "Capability config for the aggregation/metrics add-on. Backend fields only.",
          "additionalProperties": false,
          "properties": {
            "measure": { "type": "boolean", "description": "Can be a metric's measure (sum/avg/min/max/count_distinct)? Default: backend ⇒ true." },
            "groupable": { "type": "boolean", "description": "Can be a GROUP BY key? Default: enum/text/bool ⇒ true." },
            "ops": { "type": "array", "items": { "$ref": "#/$defs/aggOp" }, "description": "Override the default aggregate-op set for the field's type." }
          }
        },
        "group": { "type": "string", "description": "Field-picker grouping bucket." },
        "alias": { "type": "string", "description": "Single alternative search term (legacy alias support)." },
        "aliases": { "type": "array", "items": { "type": "string" }, "description": "Extra search terms for the picker." },
        "display": { "$ref": "#/$defs/cellDisplay" },
        "render": { "type": "string", "description": "Render-registry key resolved on the frontend (code, not data — only the key is stored)." },
        "property": {
          "$ref": "#/$defs/propertyField"
        },
        "origin": {
          "type": "object",
          "required": [
            "table",
            "column"
          ],
          "additionalProperties": false,
          "properties": {
            "table": {
              "type": "string",
              "minLength": 1
            },
            "column": {
              "type": "string",
              "minLength": 1
            }
          }
        },
        "relationship": {
          "type": "object",
          "required": [
            "objectType",
            "key"
          ],
          "additionalProperties": false,
          "properties": {
            "objectType": {
              "type": "string",
              "minLength": 1
            },
            "key": {
              "type": "object",
              "minProperties": 1,
              "additionalProperties": {
                "type": "string",
                "minLength": 1
              }
            }
          }
        },
        "bindings": {
          "type": "object",
          "description": "Per-backend binding, keyed by backend id so one schema can serve several backends.",
          "additionalProperties": false,
          "properties": { "postgres": { "$ref": "#/$defs/sqlBinding" }, "sqlite": { "$ref": "#/$defs/sqliteBinding" }, "duckdb": { "$ref": "#/$defs/duckdbBinding" } }
        }
      }
    },
    "jsonCellDisplay": {
      "type": "object",
      "required": [
        "kind"
      ],
      "additionalProperties": false,
      "properties": {
        "kind": {
          "enum": [
            "json"
          ]
        },
        "encoding": {
          "enum": [
            "auto",
            "value",
            "json",
            "escaped"
          ]
        },
        "maxDecodeDepth": {
          "type": "integer",
          "minimum": 1,
          "maximum": 8
        },
        "previewLength": {
          "type": "integer",
          "minimum": 20,
          "maximum": 500
        },
        "expandDepth": {
          "type": "integer",
          "minimum": 0,
          "maximum": 8
        }
      }
    },
    "chipCellDisplay": {
      "type": "object",
      "required": [
        "kind"
      ],
      "additionalProperties": false,
      "properties": {
        "kind": {
          "enum": [
            "chip"
          ]
        },
        "labels": {
          "type": "object",
          "additionalProperties": {
            "type": "string"
          }
        },
        "tones": {
          "type": "object",
          "additionalProperties": {
            "enum": [
              "neutral",
              "success",
              "warning",
              "danger"
            ]
          }
        }
      }
    },
    "cellDisplay": {
      "description": "Built-in cell presentation. Query field types and backend bindings remain independent. An explicit registered render key or function overrides display.",
      "oneOf": [
        {
          "$ref": "#/$defs/jsonCellDisplay"
        },
        {
          "type": "object",
          "required": [
            "kind"
          ],
          "additionalProperties": false,
          "properties": {
            "kind": {
              "enum": [
                "date",
                "datetime"
              ]
            },
            "style": {
              "enum": [
                "human",
                "iso",
                "custom"
              ]
            },
            "pattern": {
              "type": "string",
              "maxLength": 160
            },
            "timeZone": {
              "type": "string"
            },
            "locale": {
              "type": "string"
            },
            "sourceUnit": {
              "enum": [
                "iso",
                "epochSeconds",
                "epochMilliseconds"
              ]
            }
          }
        },
        {
          "type": "object",
          "required": [
            "kind"
          ],
          "additionalProperties": false,
          "properties": {
            "kind": {
              "enum": [
                "time"
              ]
            },
            "style": {
              "enum": [
                "human",
                "iso",
                "custom"
              ]
            },
            "pattern": {
              "type": "string",
              "maxLength": 160
            },
            "timeZone": {
              "type": "string"
            },
            "locale": {
              "type": "string"
            },
            "sourceUnit": {
              "enum": [
                "iso",
                "epochSeconds",
                "epochMilliseconds",
                "secondsOfDay",
                "millisecondsOfDay"
              ]
            }
          }
        },
        {
          "type": "object",
          "required": [
            "kind"
          ],
          "additionalProperties": false,
          "properties": {
            "kind": {
              "enum": [
                "duration"
              ]
            },
            "sourceUnit": {
              "enum": [
                "milliseconds",
                "seconds",
                "minutes",
                "hours",
                "days"
              ]
            },
            "style": {
              "enum": [
                "human",
                "long",
                "clock",
                "custom"
              ]
            },
            "pattern": {
              "type": "string",
              "maxLength": 160
            },
            "decimals": {
              "type": "integer",
              "minimum": 0,
              "maximum": 20
            }
          }
        },
        {
          "type": "object",
          "required": [
            "kind"
          ],
          "additionalProperties": false,
          "properties": {
            "kind": {
              "enum": [
                "number",
                "percent"
              ]
            },
            "decimals": {
              "type": "integer",
              "minimum": 0,
              "maximum": 20
            },
            "locale": {
              "type": "string"
            }
          }
        },
        {
          "$ref": "#/$defs/chipCellDisplay"
        },
        {
          "type": "object",
          "required": [
            "kind"
          ],
          "additionalProperties": false,
          "properties": {
            "kind": {
              "enum": [
                "text"
              ]
            },
            "truncate": {
              "type": "boolean"
            }
          }
        }
      ]
    },
    "filterValues": {
      "description": "How filter-value candidates are offered. Default everywhere is autocomplete (backend distinct-value search, refined per keystroke).",
      "oneOf": [
        { "type": "object", "required": ["source"], "additionalProperties": false, "properties": { "source": { "const": "autocomplete" } } },
        {
          "type": "object",
          "required": ["source", "options"],
          "additionalProperties": false,
          "properties": { "source": { "const": "static" }, "options": { "type": "array", "items": { "oneOf": [{ "type": "string" }, { "type": "object", "required": ["value", "label"], "additionalProperties": false, "properties": { "value": { "type": "string" }, "label": { "type": "string" } } }] } } }
        },
        { "type": "object", "required": ["source"], "additionalProperties": false, "properties": { "source": { "const": "freeform" } } }
      ]
    },
    "duckdbBinding": {
      "type": "object",
      "required": ["expr"],
      "additionalProperties": false,
      "properties": {
        "expr": { "type": "string", "minLength": 1, "description": "Trusted DuckDB SQL expression. Native VARCHAR[] arrays and DATE/TIMESTAMP/TIMESTAMPTZ are supported; never derived from request input." }
      }
    },
    "sqliteBinding": {
      "type": "object",
      "required": ["expr"],
      "additionalProperties": false,
      "properties": {
        "expr": { "type": "string", "minLength": 1, "description": "Trusted SQLite expression; never derived from request input. textarray bindings store JSON arrays of strings." },
        "synthetic": { "type": "boolean", "default": false },
        "kind": { "enum": ["text", "number", "datetime", "bool", "enum", "textarray"] },
        "expressionNumeric": { "type": "boolean", "default": false, "description": "Trusted opt-in for numeric bindings used by the bounded SQLite v2 expression profile." },
        "datetimeFormat": { "enum": ["rfc3339", "utc-millis", "unix-seconds", "unix-millis"], "description": "Datetime storage: RFC3339 text is normalized by default; utc-millis certifies fixed-width UTC text for indexed sorting and comparisons." }
      }
    },
    "sqlBinding": {
      "type": "object",
      "required": ["expr"],
      "additionalProperties": false,
      "properties": {
        "expr": {
          "type": "string",
          "description": "Server-defined SQL expression (e.g. \"r.commit_id\" or \"(r.stats->>'duration_ms')::numeric\"). NEVER derived from request input — it and the validated operator are the only request-influenced tokens that reach SQL; values are always bound parameters."
        },
        "synthetic": { "type": "boolean", "default": false, "description": "Computed expression with no backing column (e.g. \"(w.tags ? 'rerun')\")." },
        "expressionNumeric": { "type": "boolean", "default": false, "description": "Trusted server opt-in for finite numeric bindings in the bounded PostgreSQL expression profile. Never accepted from query request input." },
        "kind": {
          "enum": ["text", "number", "datetime", "bool", "enum", "textarray"],
          "description": "SQL coercion path. Defaults to the field's `type`; override when the column's SQL type differs."
        }
      }
    }
  }
}
